{
  "id": "saas-mvp",
  "name": "SaaS MVP",
  "type": "project",
  "status": "Auth module complete, dashboard half-built, onboarding not started",
  "mode": "active",
  "momentum": "medium",
  "priority": "high",
  "blocked": null,
  "next_move": "Finish dashboard data visualization — the chart component is 80% done",
  "last_decision": "Cut onboarding wizard from v1 — just show empty state with a getting-started card",
  "evidence_of_progress": "Auth working with Google OAuth, 3 API routes tested, database seeded",
  "open_questions": [
    "Should we add Stripe in v1 or keep it free?",
    "Is the current dashboard layout too complex for first-time users?"
  ],
  "related_entities": ["marketing-site", "analytics-infra"],
  "metadata": {
    "path": "/Users/dev/saas-mvp",
    "repo": "github.com/builder/saas-mvp",
    "stack": "Next.js, Postgres, Tailwind"
  },
  "created_at": "2026-03-15",
  "last_updated": "2026-04-28"
}
